Enter password: ***********
Welcome to the MySQL monitor.  Commands end with ; or \g.
Your MySQL connection id is 9
Server version: 8.0.22 MySQL Community Server - GPL

Copyright (c) 2000, 2020, Oracle and/or its affiliates. All rights reserved.

Oracle is a registered trademark of Oracle Corporation and/or its
affiliates. Other names may be trademarks of their respective
owners.

Type 'help;' or '\h' for help. Type '\c' to clear the current input statement.

mysql> show databases;
+--------------------+
| Database           |
+--------------------+
| information_schema |
| mysql              |
| performance_schema |
| sakila             |
| sys                |
| world              |
+--------------------+
6 rows in set (0.04 sec)

mysql> create database prog1;
Query OK, 1 row affected (0.23 sec)

mysql> show databases;
+--------------------+
| Database           |
+--------------------+
| information_schema |
| mysql              |
| performance_schema |
| prog1              |
| sakila             |
| sys                |
| world              |
+--------------------+
7 rows in set (0.02 sec)

mysql> use prog1;
Database changed
mysql> CREATE TABLE PUBLISHER
    -> (NAME VARCHAR(20)PRIMARY KEY,
    -> PHONE INTEGER,
    -> ADDRESS VARCHAR(20));
Query OK, 0 rows affected (2.88 sec)

mysql>
mysql> CREATE TABLE BOOK
    -> (BOOK_ID INTEGER PRIMARY KEY,
    -> TITLE VARCHAR(20),
    -> PUB_YEAR VARCHAR(20),
    -> PUBLISHER_NAME VARCHAR(20)REFERENCES PUBLISHER(NAME) ON DELETE CASCADE);
Query OK, 0 rows affected (0.83 sec)

mysql>
mysql> CREATE TABLE BOOK_AUTHORS
    -> (AUTHOR_NAME VARCHAR(20),
    -> BOOK_ID INT REFERENCES BOOK(BOOK_ID) ON DELETE CASCADE,
    -> PRIMARY KEY (BOOK_ID, AUTHOR_NAME));
Query OK, 0 rows affected (1.00 sec)

mysql>
mysql> CREATE TABLE LIBRARY_BRANCH
    -> (BRANCH_ID INTEGER PRIMARY KEY,
    -> BRANCH_NAME VARCHAR(50),
    -> ADDRESS VARCHAR(50));
Query OK, 0 rows affected (1.96 sec)

mysql>
mysql> CREATE TABLE BOOK_COPIES
    -> (NO_OF_COPIES INTEGER,
    -> BOOK_ID INT REFERENCES BOOK(BOOK_ID) ON DELETE CASCADE,
    -> BRANCH_ID INT REFERENCES LIBRARY_BRANCH(BRANCH_ID) ON DELETE CASCADE,
    -> PRIMARY KEY (BOOK_ID, BRANCH_ID));
Query OK, 0 rows affected (1.49 sec)

mysql>
mysql> CREATE TABLE CARD
    -> (CARD_NO INTEGER PRIMARY KEY);
Query OK, 0 rows affected (0.94 sec)

mysql>
mysql> CREATE TABLE BOOK_LENDING
    -> (DATE_OUT DATE,
    -> DUE_DATE DATE,
    -> BOOK_ID INT REFERENCES BOOK (BOOK_ID) ON DELETE CASCADE,
    -> BRANCH_ID INT REFERENCES LIBRARY_BRANCH (BRANCH_ID) ON DELETE CASCADE,
    -> CARD_NO INT REFERENCES CARD (CARD_NO) ON DELETE CASCADE,
    -> PRIMARY KEY (BOOK_ID, BRANCH_ID, CARD_NO));
Query OK, 0 rows affected (1.04 sec)

mysql>
mysql> INSERT INTO PUBLISHER VALUES ('MCGRAW-HILL', 9989076587, 'BANGALORE');
ERROR 1264 (22003): Out of range value for column 'PHONE' at row 1
mysql> INSERT INTO PUBLISHER VALUES ('PEARSON', 9889076565, 'NEWDELHI');
ERROR 1264 (22003): Out of range value for column 'PHONE' at row 1
mysql> INSERT INTO PUBLISHER VALUES ('RANDOM HOUSE', 7455679345, 'HYDRABAD');
ERROR 1264 (22003): Out of range value for column 'PHONE' at row 1
mysql> INSERT INTO PUBLISHER VALUES ('HACHETTE LIVRE', 8970862340, 'CHENAI');
ERROR 1264 (22003): Out of range value for column 'PHONE' at row 1
mysql> INSERT INTO PUBLISHER VALUES ('GRUPO PLANETA', 7756120238, 'BANGALORE');
ERROR 1264 (22003): Out of range value for column 'PHONE' at row 1
mysql> INSERT INTO BOOK VALUES (1,'DBMS','JAN-2017', 'MCGRAW-HILL');
Query OK, 1 row affected (0.26 sec)

mysql> INSERT INTO BOOK VALUES (2,'ADBMS','JUN-2016', 'MCGRAW-HILL');
Query OK, 1 row affected (0.34 sec)

mysql> INSERT INTO BOOK VALUES (3,'CN','SEP-2016', 'PEARSON');
Query OK, 1 row affected (0.14 sec)

mysql> INSERT INTO BOOK VALUES (4,'CG','SEP-2015', 'GRUPO PLANETA');
Query OK, 1 row affected (0.09 sec)

mysql> INSERT INTO BOOK VALUES (5,'OS','MAY-2016', 'PEARSON');
Query OK, 1 row affected (0.13 sec)

mysql> INSERT INTO BOOK_AUTHORS VALUES ('NAVATHE', 1);
Query OK, 1 row affected (0.16 sec)

mysql> INSERT INTO BOOK_AUTHORS VALUES ('NAVATHE', 2);
Query OK, 1 row affected (0.18 sec)

mysql> INSERT INTO BOOK_AUTHORS VALUES ('TANENBAUM', 3);
Query OK, 1 row affected (0.12 sec)

mysql> INSERT INTO BOOK_AUTHORS VALUES ('EDWARD ANGEL', 4);
Query OK, 1 row affected (0.19 sec)

mysql> INSERT INTO BOOK_AUTHORS VALUES ('GALVIN', 5);
Query OK, 1 row affected (0.09 sec)

mysql> INSERT INTO LIBRARY_BRANCH VALUES (10,'RR NAGAR','BANGALORE');
Query OK, 1 row affected (0.14 sec)

mysql> INSERT INTO LIBRARY_BRANCH VALUES (11,'RNSIT','BANGALORE');
Query OK, 1 row affected (0.14 sec)

mysql> INSERT INTO LIBRARY_BRANCH VALUES (12,'RAJAJI NAGAR', 'BANGALORE');
Query OK, 1 row affected (0.29 sec)

mysql> INSERT INTO LIBRARY_BRANCH VALUES (13,'NITTE','MANGALORE');
Query OK, 1 row affected (0.28 sec)

mysql> INSERT INTO LIBRARY_BRANCH VALUES (14,'MANIPAL','UDUPI');
Query OK, 1 row affected (0.11 sec)

mysql> INSERT INTO BOOK_COPIES VALUES (10, 1, 10);
Query OK, 1 row affected (0.05 sec)

mysql> INSERT INTO BOOK_COPIES VALUES (5, 1, 11);
Query OK, 1 row affected (0.15 sec)

mysql> INSERT INTO BOOK_COPIES VALUES (2, 2, 12);
Query OK, 1 row affected (0.10 sec)

mysql> INSERT INTO BOOK_COPIES VALUES (5, 2, 13);
Query OK, 1 row affected (0.05 sec)

mysql> INSERT INTO BOOK_COPIES VALUES (7, 3, 14);
Query OK, 1 row affected (0.12 sec)

mysql> INSERT INTO BOOK_COPIES VALUES (1, 5, 10);
Query OK, 1 row affected (0.31 sec)

mysql> INSERT INTO BOOK_COPIES VALUES (3, 4, 11);
Query OK, 1 row affected (0.19 sec)

mysql> INSERT INTO CARD VALUES (100);
Query OK, 1 row affected (0.09 sec)

mysql> INSERT INTO CARD VALUES (101);
Query OK, 1 row affected (0.11 sec)

mysql> INSERT INTO CARD VALUES (102);
Query OK, 1 row affected (0.15 sec)

mysql> INSERT INTO CARD VALUES (103);
Query OK, 1 row affected (0.12 sec)

mysql> INSERT INTO CARD VALUES (104);
Query OK, 1 row affected (0.30 sec)

mysql> INSERT INTO BOOK_LENDING VALUES ('2020-01-01','2020-06-01', 1, 10, 101);
Query OK, 1 row affected (0.20 sec)

mysql> INSERT INTO BOOK_LENDING VALUES ('2020-01-11','2020-03-11', 3, 14, 101);
Query OK, 1 row affected (0.14 sec)

mysql> INSERT INTO BOOK_LENDING VALUES ('2020-02-21','2020-04-21', 2, 13, 101);
Query OK, 1 row affected (0.15 sec)

mysql> INSERT INTO BOOK_LENDING VALUES ('2020-03-15','2020-06-15', 4, 11, 101);
Query OK, 1 row affected (0.10 sec)

mysql> INSERT INTO BOOK_LENDING VALUES ('2020-04-12','2020-05-12', 1, 11, 104);
Query OK, 1 row affected (0.12 sec)

mysql>
mysql>
mysql>
mysql> SELECT B.BOOK_ID, B.TITLE, B.PUBLISHER_NAME, A.AUTHOR_NAME,
    -> C.NO_OF_COPIES, L.BRANCH_ID
    -> FROM BOOK AS B, BOOK_AUTHORS AS A, BOOK_COPIES AS C, LIBRARY_BRANCH AS L
    -> WHERE B.BOOK_ID=A.BOOK_ID
    -> AND B.BOOK_ID=C.BOOK_ID
    -> AND L.BRANCH_ID=C.BRANCH_ID;
+---------+-------+----------------+--------------+--------------+-----------+
| BOOK_ID | TITLE | PUBLISHER_NAME | AUTHOR_NAME  | NO_OF_COPIES | BRANCH_ID |
+---------+-------+----------------+--------------+--------------+-----------+
|       1 | DBMS  | MCGRAW-HILL    | NAVATHE      |           10 |        10 |
|       1 | DBMS  | MCGRAW-HILL    | NAVATHE      |            5 |        11 |
|       2 | ADBMS | MCGRAW-HILL    | NAVATHE      |            2 |        12 |
|       2 | ADBMS | MCGRAW-HILL    | NAVATHE      |            5 |        13 |
|       3 | CN    | PEARSON        | TANENBAUM    |            7 |        14 |
|       4 | CG    | GRUPO PLANETA  | EDWARD ANGEL |            3 |        11 |
|       5 | OS    | PEARSON        | GALVIN       |            1 |        10 |
+---------+-------+----------------+--------------+--------------+-----------+
7 rows in set (0.07 sec)

mysql>
mysql>
mysql> SELECT CARD_NO
    -> FROM BOOK_LENDING
    -> WHERE DATE_OUT BETWEEN '2020-01-01' AND '2020-07-01'
    -> GROUP BY CARD_NO
    -> HAVING COUNT(*)>3;
+---------+
| CARD_NO |
+---------+
|     101 |
+---------+
1 row in set (0.36 sec)

mysql>
mysql> DELETE FROM BOOK
    -> WHERE BOOK_ID=3;
Query OK, 1 row affected (0.08 sec)

mysql>
mysql> CREATE VIEW V_PUBLICATION AS
    -> SELECT PUB_YEAR
    -> FROM BOOK;
Query OK, 0 rows affected (0.22 sec)

mysql>
mysql> SELECT * FROM V_PUBLICATION;
+----------+
| PUB_YEAR |
+----------+
| JAN-2017 |
| JUN-2016 |
| SEP-2015 |
| MAY-2016 |
+----------+
4 rows in set (0.00 sec)

mysql>
mysql> CREATE VIEW V_BOOKS AS
    -> SELECT B.BOOK_ID, B.TITLE, C.NO_OF_COPIES
    -> FROM BOOK AS B, BOOK_COPIES AS C, LIBRARY_BRANCH AS L
    -> WHERE B.BOOK_ID=C.BOOK_ID
    -> AND C.BRANCH_ID=L.BRANCH_ID;
Query OK, 0 rows affected (0.11 sec)

mysql>
mysql> SELECT * FROM V_BOOKS;
+---------+-------+--------------+
| BOOK_ID | TITLE | NO_OF_COPIES |
+---------+-------+--------------+
|       1 | DBMS  |           10 |
|       1 | DBMS  |            5 |
|       2 | ADBMS |            2 |
|       2 | ADBMS |            5 |
|       4 | CG    |            3 |
|       5 | OS    |            1 |
+---------+-------+--------------+
6 rows in set (0.00 sec)

mysql>