Enter password: ***********
Welcome to the MySQL monitor.  Commands end with ; or \g.
Your MySQL connection id is 10
Server version: 8.0.22 MySQL Community Server - GPL

Copyright (c) 2000, 2020, Oracle and/or its affiliates. All rights reserved.

Oracle is a registered trademark of Oracle Corporation and/or its
affiliates. Other names may be trademarks of their respective
owners.

Type 'help;' or '\h' for help. Type '\c' to clear the current input statement.

mysql> show databases;
+--------------------+
| Database           |
+--------------------+
| information_schema |
| mysql              |
| performance_schema |
| prog1              |
| sakila             |
| sys                |
| world              |
+--------------------+
7 rows in set (0.11 sec)

mysql> create database prog2;
Query OK, 1 row affected (0.28 sec)

mysql> show databases;
+--------------------+
| Database           |
+--------------------+
| information_schema |
| mysql              |
| performance_schema |
| prog1              |
| prog2              |
| sakila             |
| sys                |
| world              |
+--------------------+
8 rows in set (0.08 sec)

mysql> use prog2;
Database changed
mysql> CREATE TABLE SALESMAN(
    -> SALESMAN_ID INT(4),
    -> NAME VARCHAR(20),
    -> CITY VARCHAR(20),
    -> COMMISSION VARCHAR(20),
    -> PRIMARY KEY (SALESMAN_ID));
Query OK, 0 rows affected, 1 warning (2.19 sec)

mysql>
mysql> CREATE TABLE CUSTOMER(
    -> CUSTOMER_ID INT(4),
    -> CUST_NAME VARCHAR(20),
    -> CITY VARCHAR(20),
    -> GRADE INT(3),
    -> PRIMARY KEY (CUSTOMER_ID),
    -> SALESMAN_ID INT(4) REFERENCES SALESMAN (SALESMAN_ID) ON DELETE SET NULL);
Query OK, 0 rows affected, 3 warnings (1.33 sec)

mysql>
mysql> CREATE TABLE ORDERS(
    -> ORD_NO INT(5),
    -> PURCHASE_AMT FLOAT(10,2),
    -> ORD_DATE DATE,
    -> PRIMARY KEY(ORD_NO),
    -> CUSTOMER_ID INT(4) REFERENCES CUSTOMER(CUSTOMER_ID) ON DELETE CASCADE,
    -> SALESMAN_ID INT(4) REFERENCES SALESMAN(SALESMAN_ID) ON DELETE CASCADE);
Query OK, 0 rows affected, 4 warnings (1.03 sec)

mysql>
mysql> INSERT INTO SALESMAN VALUES (1000, 'JOHN','BANGALORE','25 %');
Query OK, 1 row affected (0.31 sec)

mysql> INSERT INTO SALESMAN VALUES (2000, 'RAVI','BANGALORE','20 %');
Query OK, 1 row affected (0.13 sec)

mysql> INSERT INTO SALESMAN VALUES (3000, 'KUMAR','MYSORE','15 %');
Query OK, 1 row affected (0.25 sec)

mysql> INSERT INTO SALESMAN VALUES (4000, 'SMITH','DELHI','30 %');
Query OK, 1 row affected (0.17 sec)

mysql> INSERT INTO SALESMAN VALUES (5000, 'HARSHA','HYDRABAD','15 %');
Query OK, 1 row affected (0.09 sec)

mysql> INSERT INTO CUSTOMER VALUES(10,'VEDASHREE','BANGALORE',100,1000);
Query OK, 1 row affected (0.15 sec)

mysql> INSERT INTO CUSTOMER VALUES(11,'ASWIN','MANGALORE',300,1000);
Query OK, 1 row affected (0.23 sec)

mysql> INSERT INTO CUSTOMER VALUES(12,'KARTHIK','CHENNAI',400,2000);
Query OK, 1 row affected (0.03 sec)

mysql> INSERT INTO CUSTOMER VALUES(13,'NANDU','BANGALORE',200,2000);
Query OK, 1 row affected (0.03 sec)

mysql> INSERT INTO CUSTOMER VALUES(14,'SANTHOSH','BANGALORE',400,3000);
Query OK, 1 row affected (0.03 sec)

mysql> INSERT INTO ORDERS VALUES(50,5000,'2020-05-04',10,1000);
Query OK, 1 row affected (0.26 sec)

mysql> INSERT INTO ORDERS VALUES(51,450,'2020-01-20',10,2000);
Query OK, 1 row affected (0.14 sec)

mysql> INSERT INTO ORDERS VALUES(52,1000,'2020-02-24',13,2000);
Query OK, 1 row affected (0.10 sec)

mysql> INSERT INTO ORDERS VALUES(53,3500,'2020-04-13',14,3000);
Query OK, 1 row affected (0.03 sec)

mysql> INSERT INTO ORDERS VALUES(54,550,'2020-08-23',12,2000);
Query OK, 1 row affected (0.07 sec)

mysql>
mysql>
mysql> SELECT GRADE,COUNT(DISTINCT CUSTOMER_ID)
    -> FROM CUSTOMER
    -> GROUP BY GRADE
    -> HAVING GRADE>(SELECT AVG(GRADE)
    -> FROM CUSTOMER
    -> WHERE CITY='BANGALORE');
+-------+-----------------------------+
| GRADE | COUNT(DISTINCT CUSTOMER_ID) |
+-------+-----------------------------+
|   300 |                           1 |
|   400 |                           2 |
+-------+-----------------------------+
2 rows in set (0.11 sec)

mysql>
mysql> SELECT SALESMAN_ID,NAME
    -> FROM SALESMAN AS A
    -> WHERE 1<(SELECT COUNT(*)
    -> FROM CUSTOMER
    -> WHERE SALESMAN_ID=A.SALESMAN_ID);
+-------------+------+
| SALESMAN_ID | NAME |
+-------------+------+
|        1000 | JOHN |
|        2000 | RAVI |
+-------------+------+
2 rows in set (0.00 sec)

mysql>
mysql> SELECT SALESMAN.SALESMAN_ID,NAME,CUST_NAME, COMMISSION
    -> FROM SALESMAN,CUSTOMER
    -> WHERE SALESMAN.CITY=CUSTOMER.CITY
    -> UNION
    -> SELECT SALESMAN_ID,NAME,'NO MATCH',COMMISSION
    -> FROM SALESMAN
    -> WHERE NOT CITY=ANY
    -> (SELECT CITY
    -> FROM CUSTOMER)
    -> ORDER BY 2 DESC;
+-------------+--------+-----------+------------+
| SALESMAN_ID | NAME   | CUST_NAME | COMMISSION |
+-------------+--------+-----------+------------+
|        4000 | SMITH  | NO MATCH  | 30 %       |
|        2000 | RAVI   | VEDASHREE | 20 %       |
|        2000 | RAVI   | NANDU     | 20 %       |
|        2000 | RAVI   | SANTHOSH  | 20 %       |
|        3000 | KUMAR  | NO MATCH  | 15 %       |
|        1000 | JOHN   | VEDASHREE | 25 %       |
|        1000 | JOHN   | NANDU     | 25 %       |
|        1000 | JOHN   | SANTHOSH  | 25 %       |
|        5000 | HARSHA | NO MATCH  | 15 %       |
+-------------+--------+-----------+------------+
9 rows in set (0.04 sec)

mysql>
mysql>
mysql> CREATE VIEW ELITSALESMAN AS
    -> SELECT B.ORD_DATE, A.SALESMAN_ID, A.NAME
    -> FROM SALESMAN AS A, ORDERS AS B
    -> WHERE A.SALESMAN_ID = B.SALESMAN_ID
    -> AND B.PURCHASE_AMT=(SELECT MAX(PURCHASE_AMT)
    -> FROM ORDERS AS C
    -> WHERE C.ORD_DATE = B.ORD_DATE);
Query OK, 0 rows affected (0.49 sec)

mysql>
mysql>
mysql> SELECT * FROM ELITSALESMAN;
+------------+-------------+-------+
| ORD_DATE   | SALESMAN_ID | NAME  |
+------------+-------------+-------+
| 2020-05-04 |        1000 | JOHN  |
| 2020-01-20 |        2000 | RAVI  |
| 2020-02-24 |        2000 | RAVI  |
| 2020-04-13 |        3000 | KUMAR |
| 2020-08-23 |        2000 | RAVI  |
+------------+-------------+-------+
5 rows in set (0.08 sec)

mysql>
mysql>
mysql> DELETE FROM SALESMAN
    -> WHERE SALESMAN_ID=1000;
Query OK, 1 row affected (0.09 sec)

mysql>
mysql> SELECT * FROM SALESMAN;
+-------------+--------+-----------+------------+
| SALESMAN_ID | NAME   | CITY      | COMMISSION |
+-------------+--------+-----------+------------+
|        2000 | RAVI   | BANGALORE | 20 %       |
|        3000 | KUMAR  | MYSORE    | 15 %       |
|        4000 | SMITH  | DELHI     | 30 %       |
|        5000 | HARSHA | HYDRABAD  | 15 %       |
+-------------+--------+-----------+------------+
4 rows in set (0.00 sec)

mysql>